appl_id,subproject_id,fiscal_year,project_num,project_serial_num,organization,award_type,activity_code,award_amount,project_num_split,principal_investigators,program_officers,agency_ic_admin,agency_ic_fundings,cong_dist,project_start_date,project_end_date,organization_type,opportunity_number,full_study_section,award_notice_date,core_project_num,pref_terms,project_title,phr_text,spending_categories_desc,arra_funded,budget_start,budget_end,cfda_code,funding_mechanism,direct_cost_amt,indirect_cost_amt
11280631,,2025,7K01AR081959-03,AR081959,"{'org_name': 'UNIVERSITY OF NEW ENGLAND', 'city': None, 'country': None, 'org_city': 'BIDDEFORD', 'org_country': 'UNITED STATES', 'org_state': 'ME', 'org_state_name': None, 'dept_type': 'OTHER BASIC SCIENCES', 'fips_country_code': None, 'org_duns': ['071735252'], 'org_ueis': ['HVE6K4YS3B51'], 'primary_duns': '071735252', 'primary_uei': 'HVE6K4YS3B51', 'org_fips': 'US', 'org_ipf_code': '1197101', 'org_zipcode': '040059526', 'external_org_id': 1197101}",7,K01,126900.0,"{'appl_type_code': '7', 'activity_code': 'K01', 'ic_code': 'AR', 'serial_num': '081959', 'support_year': '03', 'full_support_year': '03', 'suffix_code': ''}","[{'profile_id': 12385857, 'first_name': 'Eben', 'middle_name': 'Grant', 'last_name': 'Estell', 'is_contact_pi': True, 'full_name': 'Eben Grant Estell', 'title': 'ASSISTANT PROFESSOR'}]","[{'first_name': 'KRISTY', 'middle_name': '', 'last_name': 'NICKS', 'full_name': 'KRISTY  NICKS'}]","{'code': 'AR', 'abbreviation': 'NIAMS', 'name': 'National Institute of Arthritis and Musculoskeletal and Skin Diseases'}","[{'fy': 2025, 'code': 'AR', 'name': 'National Institute of Arthritis and Musculoskeletal and Skin Diseases', 'abbreviation': 'NIAMS', 'total_cost': 126900.0, 'direct_cost_ic': 117500.0, 'indirect_cost_ic': 9400.0}]",ME-01,2025-02-01T00:00:00,2028-01-31T00:00:00,"{'name': 'SCHOOLS OF OSTEOPATHIC MEDICINE', 'code': '10', 'is_other': False}",PA-24-254,"{'srg_code': 'ZAR1', 'srg_flex': None, 'sra_designator_code': 'MEP', 'sra_flex_code': None, 'group_code': 'M1', 'name': 'ZAR1-MEP(M1)M'}",2025-03-13T00:00:00,K01AR081959,Address;Adipose tissue;Affect;Alleles;Anabolism;Back;Binding Proteins;Bone Density;Bone Diseases;Bone Resorption;Bone remodeling;Brain;Calcium;Calcium Signaling;Catabolism;Cell Line;Cell Nucleus;Cell membrane;Cell model;Cells;Chemicals;Coculture Techniques;Coupling;Cues;Degenerative Disorder;Dose;Equilibrium;Estrogens;Event;Exercise;Fibronectins;Future;Genetic;Genetic Transcription;Homeostasis;Hormones;Image;In Vitro;Infusion procedures;Integrins;Investigation;Knockout Mice;Liquid substance;LoxP-flanked allele;Maintenance;Mediating;Mitochondria;Modeling;Mus;Muscle;Osteoblasts;Osteoclasts;Osteocytes;Osteogenesis;Pathway interactions;Peptide Signal Sequences;Physiological;Protein Secretion;Proteins;Proteomics;Regulation;Research;Respiration;Role;Serum;Signal Pathway;Signal Transduction;Skeletal Development;Skeletal Muscle;TRANCE protein;Techniques;Testing;Therapeutic;Thick;Tissue Model;Tissues;Wild Type Mouse;Work;aging population;bone;bone health;bone loss;chemical release;conditional knockout;cortical bone;deprivation;experimental study;functional outcomes;genetic approach;in vivo;in vivo Model;insight;mechanical signal;mechanical stimulus;novel;osteoclastogenesis;ovariectomy-induced bone loss;pleiotropism;prevent;programs;receptor;release factor;response;skeletal;therapeutic development;transcriptome sequencing,The Role of Irisin in Initiating Resorption During the Skeletal Response to Exercise,"PROJECT NARRATIVE
Exercise and physical loading support bone health, and better understanding the cellular mechanisms involved
will help to treat an aging population facing degenerative bone diseases. This project studies the signaling
pathways by which irisin, a signaling factor released from muscle during exercise, affects key cells within bone
to guide adaptation of the tissue. By delineating these mechanisms, our work will contribute to the
understanding of skeletal adaption and inform future efforts at developing therapeutics to protect bone health.",,N,2025-02-01T00:00:00,2026-01-31T00:00:00,93.846,Other Research-Related,117500.0,9400.0
11035540,,2025,1R25OD039833-01,OD039833,"{'org_name': 'JACKSON LABORATORY', 'city': None, 'country': None, 'org_city': 'BAR HARBOR', 'org_country': 'UNITED STATES', 'org_state': 'ME', 'org_state_name': None, 'dept_type': None, 'fips_country_code': None, 'org_duns': ['042140483'], 'org_ueis': ['XR6LMXNKDJJ1'], 'primary_duns': '042140483', 'primary_uei': 'XR6LMXNKDJJ1', 'org_fips': 'US', 'org_ipf_code': '7096501', 'org_zipcode': '046091523', 'external_org_id': 7096501}",1,R25,327935.0,"{'appl_type_code': '1', 'activity_code': 'R25', 'ic_code': 'OD', 'serial_num': '039833', 'support_year': '01', 'full_support_year': '01', 'suffix_code': ''}","[{'profile_id': 2402162, 'first_name': 'Gary', 'middle_name': 'A', 'last_name': 'Churchill', 'is_contact_pi': True, 'full_name': 'Gary A Churchill', 'title': 'PROFESSOR'}, {'profile_id': 2650198, 'first_name': 'VIVEK', 'middle_name': '', 'last_name': 'KUMAR', 'is_contact_pi': False, 'full_name': 'VIVEK  KUMAR', 'title': 'ASSOCIATE PROFESSOR'}]","[{'first_name': 'GEORGE', 'middle_name': '', 'last_name': 'PAPANICOLAOU', 'full_name': 'GEORGE  PAPANICOLAOU'}]","{'code': 'OD', 'abbreviation': 'OD', 'name': 'NIH Office of the Director'}","[{'fy': 2025, 'code': 'DE', 'name': 'National Institute of Dental and Craniofacial Research', 'abbreviation': 'NIDCR', 'total_cost': 1.0, 'direct_cost_ic': 1.0, 'indirect_cost_ic': 0.0}, {'fy': 2025, 'code': 'OD', 'name': 'NIH Office of the Director', 'abbreviation': 'OD', 'total_cost': 327934.0, 'direct_cost_ic': 307588.0, 'indirect_cost_ic': 20346.0}]",ME-02,2025-01-03T00:00:00,2027-12-31T00:00:00,"{'name': 'Research Institutes', 'code': '20', 'is_other': False}",RFA-RM-23-014,"{'srg_code': 'ZRG1', 'srg_flex': None, 'sra_designator_code': 'BBBT', 'sra_flex_code': 'A', 'group_code': '58', 'name': 'Special Emphasis Panel[ZRG1 BBBT-A (58)]'}",2025-01-03T00:00:00,R25OD039833,Acceleration;Authorship;Biological;Biomedical Research;Climate;Collaborations;Communication;Communities;Conflict (Psychology);Course Content;Data;Data Analyses;Data Science;Data Set;Education;Educational Curriculum;Environment;Experimental Designs;Faculty;Fostering;Funding;Genotype-Tissue Expression Project;Goals;High Performance Computing;Immersion;Instruction;International;Knowledge;LinkedIn;Mentors;Methods;Multiomic Data;Participant;Performance;Persons;Postdoctoral Fellow;Productivity;Publishing;Reproducibility;Research;Research Personnel;Role;Rotation;Social Network;Specialist;Sports;Students;Technical Expertise;Techniques;Technology;The Jackson Laboratory;Training;Training Activity;Underrepresented Minority;Woman;Work;career development;data management;doctoral student;experience;faculty mentor;genomic data;improved;instructor;interest;large scale data;learning materials;lectures;live stream;member;metabolomics;molecular scale;multiple data types;patient engagement;prevent;programs;recruit;skills;sound;tool;web site,Short Course on Methods for MultiOmics Data Analysis,"PROJECT NARRATIVE
Our Short Course on Methods for MultiOmics Data Analysis will increase knowledge of genomic data science,
elevate the scientific and translational value of Common Fund data, and grow the community of Common Fund
data users with an emphasis on women and underrepresented minorities. We will accomplish this through an
intensive immersion experience in an environment that brings together participants and faculty with diverse
backgrounds who share an interest in applying genomic data science in their work.",,N,2025-01-03T00:00:00,2025-12-31T00:00:00,93.310,Other Research-Related,307589.0,20346.0
11048708,,2025,1R01CA288836-01A1,CA288836,"{'org_name': 'JACKSON LABORATORY', 'city': None, 'country': None, 'org_city': 'BAR HARBOR', 'org_country': 'UNITED STATES', 'org_state': 'ME', 'org_state_name': None, 'dept_type': None, 'fips_country_code': None, 'org_duns': ['042140483'], 'org_ueis': ['XR6LMXNKDJJ1'], 'primary_duns': '042140483', 'primary_uei': 'XR6LMXNKDJJ1', 'org_fips': 'US', 'org_ipf_code': '7096501', 'org_zipcode': '046091523', 'external_org_id': 7096501}",1,R01,754511.0,"{'appl_type_code': '1', 'activity_code': 'R01', 'ic_code': 'CA', 'serial_num': '288836', 'support_year': '01', 'full_support_year': '01A1', 'suffix_code': 'A1'}","[{'profile_id': 8683998, 'first_name': 'Edison', 'middle_name': 'Tak-Bun', 'last_name': 'Liu', 'is_contact_pi': True, 'full_name': 'Edison Tak-Bun Liu', 'title': ''}]","[{'first_name': 'YIN', 'middle_name': '', 'last_name': 'LIU', 'full_name': 'YIN  LIU'}]","{'code': 'CA', 'abbreviation': 'NCI', 'name': 'National Cancer Institute'}","[{'fy': 2025, 'code': 'CA', 'name': 'National Cancer Institute', 'abbreviation': 'NCI', 'total_cost': 754511.0, 'direct_cost_ic': 447718.0, 'indirect_cost_ic': 306793.0}]",ME-02,2024-12-13T00:00:00,2029-11-30T00:00:00,"{'name': 'Research Institutes', 'code': '20', 'is_other': False}",PA-20-185,"{'srg_code': 'TIO', 'srg_flex': None, 'sra_designator_code': None, 'sra_flex_code': None, 'group_code': None, 'name': 'Translational Immuno-oncology Study Section[TIO]'}",2024-12-12T00:00:00,R01CA288836,Affect;Algorithms;Anti-CD47;Antibodies;Antitumor Response;Autoimmunity;Biological Assay;Biological Markers;Blocking Antibodies;Breast Cancer Model;Breast Carcinoma;Calibration;Cancer Model;Cancer Patient;Candidate Disease Gene;Cell Line;Cell Transplantation;Cells;Characteristics;Chromosome Mapping;Chromosomes;Clinical;Clinical Trials;Colorectal Cancer;Computational algorithm;Cytokine Activation;Data;Disease;Disease remission;Disseminated Malignant Neoplasm;Effectiveness;Elements;Emulsions;Encapsulated;Generations;Genes;Genetic;Genetic Epistasis;Genetic Variation;Genome;Genomics;Germ Lines;Heritability;Human;Immune;Immune checkpoint inhibitor;Immune response;Immune system;Immunologics;Immunotherapy;In Vitro;Inbreeding;MC38;Malignant Neoplasms;Maps;Measures;Microcapsules drug delivery system;Microfluidics;Modeling;Molecular;Mus;Mutation;Outcome;Patients;Permeability;Pharmacotherapy;Play;Portraits;Preclinical data;Quantitative Trait Loci;Rapid screening;Recombinant Cytokines;Recombinants;Refractory;Role;Sampling;System;Technology;Testing;Therapeutic;Therapeutic Intervention;Transplantation;Variant;Work;anti-CTLA4;anti-PD-L1;anti-PD1 antibodies;anti-PD1 therapy;attenuation;biomarker validation;candidate selection;clinically relevant;design;differential expression;first-in-human;gene interaction;genetic analysis;genetic element;genetic makeup;immune checkpoint;improved;in vivo;inhibitor therapy;innovation;mouse model;neoplastic cell;novel;novel strategies;novel therapeutics;patient subsets;pre-clinical;predictive marker;preservation;programmed cell death ligand 1;prototype;receptor;refractory cancer;responders and non-responders;response;screening;success;theranostics;trait;transcriptomics;tumor;tumor microenvironment;tumor-immune system interactions,Discovery of host genetic elements affecting response to immune checkpoint inhibitors,"PROJECT NARRATIVE
Despite the remarkable clinical success of immune checkpoint inhibitors (ICIs) in treating previously refractory
cancers, the majority of patients still do not have meaningful responses, likely due to tumor-intrinsic and to host-
specific factors such as the genetic make-up of the patient. We have developed powerful genetic platforms based
on advanced genetically diverse mouse models, computational algorithms, and patient-derived micro-
organosphere (MOS) technology to map genes in both mice and humans that modify host response to an ICI.
Our enhanced understanding of host genetic mechanisms governing ICI response will be important to devising
predictive biomarkers and, importantly, novel therapeutics to enhance ICI effectiveness; thus, we now propose
to expand on our recent discoveries to precisely define the genetic network controlling host response to ICIs,
and to test emerging ICI and ICI combinations in our integrated genetic diversity/MOS system.",,N,2024-12-13T00:00:00,2025-11-30T00:00:00,93.396,Non-SBIR/STTR,447718.0,306793.0
11165732,,2025,1F32DC022781-01,DC022781,"{'org_name': 'JACKSON LABORATORY', 'city': None, 'country': None, 'org_city': 'BAR HARBOR', 'org_country': 'UNITED STATES', 'org_state': 'ME', 'org_state_name': None, 'dept_type': None, 'fips_country_code': None, 'org_duns': ['042140483'], 'org_ueis': ['XR6LMXNKDJJ1'], 'primary_duns': '042140483', 'primary_uei': 'XR6LMXNKDJJ1', 'org_fips': 'US', 'org_ipf_code': '7096501', 'org_zipcode': '046091523', 'external_org_id': 7096501}",1,F32,75520.0,"{'appl_type_code': '1', 'activity_code': 'F32', 'ic_code': 'DC', 'serial_num': '022781', 'support_year': '01', 'full_support_year': '01', 'suffix_code': ''}","[{'profile_id': 14845620, 'first_name': 'Lubriel', 'middle_name': '', 'last_name': 'Sambolin-Escobales', 'is_contact_pi': True, 'full_name': 'Lubriel  Sambolin-Escobales', 'title': 'POSTDOCTORAL RESEARCH ASSOCIATE'}]","[{'first_name': 'JACLYN', 'middle_name': 'REBECCA', 'last_name': 'SCHURMAN', 'full_name': 'JACLYN REBECCA SCHURMAN'}]","{'code': 'DC', 'abbreviation': 'NIDCD', 'name': 'National Institute on Deafness and Other Communication Disorders'}","[{'fy': 2025, 'code': 'DC', 'name': 'National Institute on Deafness and Other Communication Disorders', 'abbreviation': 'NIDCD', 'total_cost': 75520.0, 'direct_cost_ic': 75520.0, 'indirect_cost_ic': 0.0}]",ME-02,2024-12-05T00:00:00,2027-12-04T00:00:00,"{'name': 'Research Institutes', 'code': '20', 'is_other': False}",PA-23-262,"{'srg_code': 'ZDC1', 'srg_flex': None, 'sra_designator_code': 'SRB', 'sra_flex_code': 'N', 'group_code': '39', 'name': 'Special Emphasis Panel[ZDC1 SRB-N (39)]'}",2024-12-05T00:00:00,F32DC022781,Aconitate Hydratase;Affect;Age;Age Months;Aging;Alleles;Amino Acid Substitution;Animal Model;Animals;Antioxidants;Atrophic;Auditory;Behavior;Biogenesis;Bipolar Neuron;Brain Stem;Cell Physiology;Cellular Morphology;Child;Citrates;Citric Acid Cycle;Cochlea;Cochlear nucleus;Collaborations;DNA Sequence Alteration;Defect;Dendrites;Development;Developmental Delay Disorders;Diet;Dose;Embryo;Energy Metabolism Pathway;Enzymes;Fibroblasts;Functional disorder;Genes;Hair Cells;Health;Homozygote;Human;Infant;Inner Hair Cells;Isocitrates;Knock-out;Label;Labyrinth;Maps;Metabolic;Mitochondria;Mitochondrial Proteins;Modeling;Morphology;Mouse Strains;Mus;Muscle hypotonia;Mutant Strains Mice;Mutation;National Institute on Deafness and Other Communication Disorders;Nerve Degeneration;Nervous System Disorder;Neurologic;Neurons;Nuclear;Optic Atrophy;Optic Nerve;Organ;Organ Culture Techniques;Organ of Corti;Outer Hair Cells;Pathology;Patients;Peripheral;Persons;Positioning Attribute;Process;Proteins;Reporter;Research;Respiration;Retinal Degeneration;Role;Seizures;Sensorineural Hearing Loss;Sensory Hair;Shapes;Signal Transduction;Supplementation;Synapses;Syndrome;Testing;Therapeutic Intervention;Time;Variant;Virus Diseases;Visualization;Zebrafish;auditory neuropathy;deafness;dosage;early onset;hearing impairment;improved;infancy;insight;mitochondrial dysfunction;mouse model;mutant;neurofilament;neuromast;neuron apoptosis;neuron development;neuron loss;neuronal cell body;noise trauma;prevent;progressive hearing loss;ribbon synapse;sound;spiral ganglion;transmission process;treatment duration;vibration;young adult,The Role of Aco2 in progressive hearing loss,"PROJECT NARRATIVE
Deafness is a major health issue affecting millions of people worldwide, and genetic mutations in mitochondrial-
related genes are a significant contributing factor. The research proposed aims to characterize the role of ACO2,
a mitochondrial enzyme in the energy metabolism pathway that was associated with syndromic hearing loss in
infants and children. A new and first Aco2 mouse model will allow us to characterize the progression of
mitochondrial dysfunction, neuronal degeneration, and deafness and to test possible therapeutic interventions.",,N,2024-12-05T00:00:00,2025-12-04T00:00:00,93.173,"Training, Individual",75520.0,0.0
11074720,,2025,1R13NS141586-01,NS141586,"{'org_name': 'JACKSON LABORATORY', 'city': None, 'country': None, 'org_city': 'BAR HARBOR', 'org_country': 'UNITED STATES', 'org_state': 'ME', 'org_state_name': None, 'dept_type': None, 'fips_country_code': None, 'org_duns': ['042140483'], 'org_ueis': ['XR6LMXNKDJJ1'], 'primary_duns': '042140483', 'primary_uei': 'XR6LMXNKDJJ1', 'org_fips': 'US', 'org_ipf_code': '7096501', 'org_zipcode': '046091523', 'external_org_id': 7096501}",1,R13,10000.0,"{'appl_type_code': '1', 'activity_code': 'R13', 'ic_code': 'NS', 'serial_num': '141586', 'support_year': '01', 'full_support_year': '01', 'suffix_code': ''}","[{'profile_id': 10363075, 'first_name': 'Gareth', 'middle_name': 'R', 'last_name': 'Howell', 'is_contact_pi': True, 'full_name': 'Gareth R Howell', 'title': 'PROFESSOR'}, {'profile_id': 9479946, 'first_name': 'Cheryl', 'middle_name': 'Lea', 'last_name': 'Wellington', 'is_contact_pi': False, 'full_name': 'Cheryl Lea Wellington', 'title': ''}]","[{'first_name': 'XILING', 'middle_name': '', 'last_name': 'YIN', 'full_name': 'XILING  YIN'}]","{'code': 'NS', 'abbreviation': 'NINDS', 'name': 'National Institute of Neurological Disorders and Stroke'}","[{'fy': 2025, 'code': 'NS', 'name': 'National Institute of Neurological Disorders and Stroke', 'abbreviation': 'NINDS', 'total_cost': 10000.0, 'direct_cost_ic': 10000.0, 'indirect_cost_ic': 0.0}]",ME-02,2024-12-01T00:00:00,2025-11-30T00:00:00,"{'name': 'Research Institutes', 'code': '20', 'is_other': False}",PA-24-141,"{'srg_code': 'ZNS1', 'srg_flex': None, 'sra_designator_code': 'SRB', 'sra_flex_code': 'K', 'group_code': '47', 'name': 'Special Emphasis Panel[ZNS1 SRB-K (47)]'}",2024-11-27T00:00:00,R13NS141586,Acceleration;Address;Age;Alzheimer's Disease;Alzheimer's disease related dementia;Applications Grants;Area;Biological Markers;Biology;Biomedical Research;Blood Vessels;Blood brain barrier dysfunction;Brain Diseases;Brain Pathology;Career Mobility;Cerebral Amyloid Angiopathy;Clinical;Cognitive aging;Collaborations;Computational Biology;Creativeness;Critiques;Data;Dementia;Development;Discipline;Disease;Disparity population;Education;Educational process of instructing;Educational workshop;Environment;Evaluation;Event;Faculty;Fostering;Funding;Future;Generations;Genetic;Genomics;Grant;Health;Human;Impaired cognition;Interdisciplinary Study;Label;Laboratories;Late Onset Alzheimer Disease;Learning;Link;Medicine;Metabolic dysfunction;Microvascular Dysfunction;Minority Groups;Modeling;Molecular;Morehouse School of Medicine;Mus;Nature;Nerve Degeneration;Neurofibrillary Tangles;Outcome;Participant;Pathology;Peripheral;Persons;Postdoctoral Fellow;Prevention;Proteomics;Recording of previous events;Research;Research Personnel;Resources;Role;Schedule;Scholarship;Science;Scientist;Second Look Surgery;Senile Plaques;Series;Study Section;Technology;The Jackson Laboratory;Time;Training;Translating;Translations;United States National Institutes of Health;Vascular Dementia;Vascular Diseases;Work;cardiovascular health;career;career development;cerebrovascular health;cognitive impairment no dementia;experience;graduate student;interest;mixed dementia;model organism;mouse model;multiple omics;neuroinflammation;next generation;posters;programs;recruit;responsible research conduct;single-cell RNA sequencing;symposium;vascular cognitive impairment and dementia;vascular contributions;vascular factor;virtual,Vascular Contributions to Cognitive Impairment and Dementia (VCID),"PROJECT NARRATIVE
The field of vascular contributions to cognitive impairment and dementia (VCID) has surged in interest in recent
years with the acceptance that vascular dysfunction may be central to cognitive aging and in many cases of
Alzheimer’s disease (AD) and related dementias. However, there is a current need for a workshop to facilitate
networking and collaboration within the interdisciplinary VCID field, to provide participants access to the latest
advances in this area, and to provide opportunities to focus resources to rapidly translate scientific discoveries
into prevention, treatment, and cure. Thus, the purpose of the proposed Jackson Laboratory (JAX) VCID
workshop is to provide a setting for participants to learn about the history of VCID, the current state of our
understanding, the recent advances and the areas emerging as key for future studies, and to develop the next,
increasingly diverse, generation of basic and clinical neuroscientists.",,N,2024-12-01T00:00:00,2025-11-30T00:00:00,93.853,Other Research-Related,10000.0,0.0
11068321,,2024,1F31HD117499-01,HD117499,"{'org_name': 'UNIVERSITY OF MAINE ORONO', 'city': None, 'country': None, 'org_city': 'ORONO', 'org_country': 'UNITED STATES', 'org_state': 'ME', 'org_state_name': None, 'dept_type': 'BIOMEDICAL ENGINEERING', 'fips_country_code': None, 'org_duns': ['186875787'], 'org_ueis': ['PB3AJE5ZEJ59'], 'primary_duns': '186875787', 'primary_uei': 'PB3AJE5ZEJ59', 'org_fips': 'US', 'org_ipf_code': '3833403', 'org_zipcode': '044695717', 'external_org_id': 3833403}",1,F31,34007.0,"{'appl_type_code': '1', 'activity_code': 'F31', 'ic_code': 'HD', 'serial_num': '117499', 'support_year': '01', 'full_support_year': '01', 'suffix_code': ''}","[{'profile_id': 77890646, 'first_name': 'Amanda', 'middle_name': 'Colleen', 'last_name': 'Ignacz', 'is_contact_pi': True, 'full_name': 'Amanda Colleen Ignacz', 'title': 'GRADUATE RESEARCH ASSISTANT'}]","[{'first_name': 'SUJATA', 'middle_name': '', 'last_name': 'BARDHAN', 'full_name': 'SUJATA  BARDHAN'}]","{'code': 'HD', 'abbreviation': 'NICHD', 'name': 'Eunice Kennedy Shriver National Institute of Child Health and Human Development'}","[{'fy': 2024, 'code': 'HD', 'name': 'Eunice Kennedy Shriver National Institute of Child Health and Human Development', 'abbreviation': 'NICHD', 'total_cost': 34007.0, 'direct_cost_ic': 34007.0, 'indirect_cost_ic': 0.0}]",,2024-12-01T00:00:00,2026-11-30T00:00:00,"{'name': 'SCHOOLS OF ARTS AND SCIENCES', 'code': '10', 'is_other': False}",PA-23-272,"{'srg_code': 'ZRG1', 'srg_flex': None, 'sra_designator_code': 'F10B', 'sra_flex_code': 'Q', 'group_code': '20', 'name': 'Special Emphasis Panel[ZRG1 F10B-Q (20)]'}",2024-09-17T00:00:00,F31HD117499,Address;Adhesions;Affect;Age;Anabolism;Automobile Driving;Biological Assay;Biology;CRISPR/Cas technology;Cell Adhesion;Cell-Matrix Junction;Cessation of life;Clinical;Communication;Complex;Confocal Microscopy;Congenital disorders of glycosylation;Cytoskeleton;Data;Development;Diffuse;Disease;Disease Management;Disease Progression;Dolichol Phosphates;Dose;Dystroglycan;Embryonic Development;Event;Exhibits;Extracellular Matrix;Foundations;Future;Generations;Genes;Genetic Models;Goals;Growth;Health;Homeostasis;Human;Knowledge;Larva;Life;Mannose;Mannosyltransferases;Membrane;Modeling;Motor Neurons;Muscle;Muscle Development;Muscular Dystrophies;Mutation;Nerve Degeneration;Neuromuscular Diseases;Neuromuscular Junction;Neurons;Patients;Phenotype;Physiology;Plasmids;Play;Polysaccharides;Post-Translational Protein Processing;Protein Glycosylation;Proteins;Quality of life;Role;Severities;Site;Skeletal Muscle;Structure;System;Testing;Tissues;Variant;Zebrafish;accurate diagnosis;confocal imaging;dystroglycanopathy;gene therapy;glycosylation;improved;in vivo;inorganic phosphate;insight;life span;man;motor neuron development;muscle degeneration;muscular structure;mutant;neural;neuromuscular;postsynaptic;prevent;protein function;receptor;stem;therapeutic target;tissue degeneration,Identifying tissue-specific interactions to bridge mechanisms underlying muscle degeneration in Congenital Disorders of Glycosylation and Dystroglycanopathies,"Both Congenital Disorders of Glycosylation and dystroglycanopathies are clinically heterogenous, multisystem
disorders that can lead to severe progressive neural and muscular degeneration, which deleteriously impacts
quality of life and is frequently lethal. There are currently no cures for these diseases. We aim to leverage a
zebrafish model to gain insight into tissue-specific impacts of dpm3 expression on neuromuscular development
and provide foundational knowledge on mechanisms of disease progression in vivo.",Brain Disorders; Congenital Muscular Dystrophy; Congenital Structural Anomalies; Intellectual and Developmental Disabilities (IDD); Muscular Dystrophy; Neurosciences; Pediatric; Rare Diseases,N,2024-12-01T00:00:00,2025-11-30T00:00:00,93.865,"Training, Individual",34007.0,0.0
