appl_id,subproject_id,fiscal_year,project_num,project_serial_num,organization,award_type,activity_code,award_amount,project_num_split,principal_investigators,program_officers,agency_ic_admin,agency_ic_fundings,cong_dist,project_start_date,project_end_date,organization_type,opportunity_number,full_study_section,award_notice_date,core_project_num,pref_terms,project_title,phr_text,spending_categories_desc,arra_funded,budget_start,budget_end,cfda_code,funding_mechanism,direct_cost_amt,indirect_cost_amt
11235561,,2025,1U01CE003694-01A1,CE003694,"{'org_name': 'MAINEHEALTH', 'city': None, 'country': None, 'org_city': 'PORTLAND', 'org_country': 'UNITED STATES', 'org_state': 'ME', 'org_state_name': None, 'dept_type': None, 'fips_country_code': None, 'org_duns': ['071732663'], 'org_ueis': ['MAYKB1LWD5U9'], 'primary_duns': '071732663', 'primary_uei': 'MAYKB1LWD5U9', 'org_fips': 'US', 'org_ipf_code': '4757601', 'org_zipcode': '041023175', 'external_org_id': 4757601}",1,U01,700000.0,"{'appl_type_code': '1', 'activity_code': 'U01', 'ic_code': 'CE', 'serial_num': '003694', 'support_year': '01', 'full_support_year': '01A1', 'suffix_code': 'A1'}","[{'profile_id': 11749628, 'first_name': 'Kinna', 'middle_name': '', 'last_name': 'Thakarar', 'is_contact_pi': True, 'full_name': 'Kinna  Thakarar', 'title': ''}]",[],"{'code': 'CE', 'abbreviation': 'NCIPC', 'name': 'National Center for Injury Prevention and Control'}","[{'fy': 2025, 'code': 'CE', 'name': 'National Center for Injury Prevention and Control', 'abbreviation': 'NCIPC', 'total_cost': 700000.0, 'direct_cost_ic': None, 'indirect_cost_ic': None}]",ME-01,2025-09-30T00:00:00,2030-09-29T00:00:00,"{'name': 'Independent Hospitals', 'code': '30', 'is_other': False}",RFA-CE-25-149,"{'srg_code': 'ZCE1', 'srg_flex': None, 'sra_designator_code': 'AW', 'sra_flex_code': None, 'group_code': '49', 'name': 'Special Emphasis Panel[ZCE1 AW (49)]'}",2025-09-23T00:00:00,U01CE003694,,CE25-149 - Enhancing Project DHARMA; evaluating a community-based drug checking navigator intervention to prevent overdoses,"Project Narrative
Fentanyl and xylazine pose new life-threatening risks to people who use drugs (PWUD), particularly in rural
areas such as in northern New England. Community-based drug checking services may be an impactful
approach to informing PWUD about their drug supply, leading to an increase in safer drug use decision-making
and behaviors, and ultimately reducing overdose; but such a strategy has yet to be evaluated. We propose a
difference-in-differences study to develop, implement, and evaluate the impact of an enhanced drug checking
navigator (DCN) intervention on overdose prevention. The study, implemented by community-based syringe
service programs, will compare differences in overdose prevalence in Maine, where the DCN intervention will
be implemented, to New Hampshire, where the intervention will not be implemented.",,N,2025-09-30T00:00:00,2026-09-29T00:00:00,93.136,Non-SBIR/STTR,,
11274644,,2025,1R21DC023369-01,DC023369,"{'org_name': 'JACKSON LABORATORY', 'city': None, 'country': None, 'org_city': 'BAR HARBOR', 'org_country': 'UNITED STATES', 'org_state': 'ME', 'org_state_name': None, 'dept_type': None, 'fips_country_code': None, 'org_duns': ['042140483'], 'org_ueis': ['XR6LMXNKDJJ1'], 'primary_duns': '042140483', 'primary_uei': 'XR6LMXNKDJJ1', 'org_fips': 'US', 'org_ipf_code': '7096501', 'org_zipcode': '046091523', 'external_org_id': 7096501}",1,R21,486750.0,"{'appl_type_code': '1', 'activity_code': 'R21', 'ic_code': 'DC', 'serial_num': '023369', 'support_year': '01', 'full_support_year': '01', 'suffix_code': ''}","[{'profile_id': 12560322, 'first_name': 'Basile', 'middle_name': 'Robin', 'last_name': 'Tarchini', 'is_contact_pi': True, 'full_name': 'Basile Robin Tarchini', 'title': 'ASSOCIATE PROFESSOR'}]","[{'first_name': 'NANCY', 'middle_name': '', 'last_name': 'FREEMAN', 'full_name': 'NANCY  FREEMAN'}]","{'code': 'DC', 'abbreviation': 'NIDCD', 'name': 'National Institute on Deafness and Other Communication Disorders'}","[{'fy': 2025, 'code': 'DC', 'name': 'National Institute on Deafness and Other Communication Disorders', 'abbreviation': 'NIDCD', 'total_cost': 486750.0, 'direct_cost_ic': 275000.0, 'indirect_cost_ic': 211750.0}]",ME-02,2025-09-12T00:00:00,2027-08-31T00:00:00,"{'name': 'Research Institutes', 'code': '20', 'is_other': False}",PA-25-304,"{'srg_code': 'AUD', 'srg_flex': None, 'sra_designator_code': None, 'sra_flex_code': None, 'group_code': None, 'name': 'Auditory System Study Section[AUD]'}",2025-09-11T00:00:00,R21DC023369,Address;Adult;Age of Onset;Aging;Apical;Architecture;Auditory;Behavior;Cell Communication;Cell Maturation;Cell Polarity;Cells;Cellular Morphology;Cilia;Cochlea;Communication;Complex;Cytoskeleton;Defect;Development;Disease;Electron Microscopy;Embryonic Development;Ensure;Epithelium;Exhibits;Eye;Genetic;Hair;Hair Cells;Height;Individual;Inner Supporting Cell;Investigation;Label;Labyrinth;Life;Methods;Microtubules;Molecular;Morphogenesis;Morphology;Mus;Neuroglia;Neurons;Noise;Organ;Outcome;Permeability;Phalanx;Phase;Pillar Cell;Play;Positioning Attribute;Process;Proteins;Proxy;Reporting;Research;Role;Science;Sensory;Shapes;Signal Transduction;Structure;Supporting Cell;Surface;System;Thinness;Tracer;Trauma;Vertebral column;Visit;Visualization;Work;body position;cell behavior;cell type;congenital hearing loss;early onset;extracellular;flexibility;hearing impairment;kinetosome;lens;migration;mosaic;mutant;neglect;novel;novel strategies;organ growth;planar cell polarity;postnatal;programs;public health relevance;scaffold;sound;tool,Exploring morphological changes in supporting cell: new cell polarity perspective and approaches,"PROJECT NARRATIVE/PUBLIC HEALTH RELEVANCE STATEMENT
Auditory function relies not only on sensory cells and second-order neurons but also on glial cells known as
supporting cells, which provide a rigid yet flexible structural scaffold crucial for amplifying low-intensity sounds,
for example. Supporting cells are highly specialized and their morphogenesis remains incompletely understood
due to extensive remodeling during cell maturation and the challenge of isolating individual cell behavior within
an intricate, repetitive organ architecture. This project introduces a novel conceptual approach and new tools to
track changes in supporting cell morphology during auditory organ development and throughout life.",,N,2025-09-12T00:00:00,2027-08-31T00:00:00,93.173,Non-SBIR/STTR,275000.0,211750.0
11137347,,2025,1UH4ES037498-01,ES037498,"{'org_name': 'NATIONAL PARTNERSHIP/ENVIRONMNTL/TECH/ED', 'city': None, 'country': None, 'org_city': 'SOUTH PORTLAND', 'org_country': 'UNITED STATES', 'org_state': 'ME', 'org_state_name': None, 'dept_type': None, 'fips_country_code': None, 'org_duns': ['001367122'], 'org_ueis': ['EL1GSAQUGGA1'], 'primary_duns': '001367122', 'primary_uei': 'EL1GSAQUGGA1', 'org_fips': 'US', 'org_ipf_code': '10024817', 'org_zipcode': '041065411', 'external_org_id': 10024817}",1,UH4,631279.0,"{'appl_type_code': '1', 'activity_code': 'UH4', 'ic_code': 'ES', 'serial_num': '037498', 'support_year': '01', 'full_support_year': '01', 'suffix_code': ''}","[{'profile_id': 78360389, 'first_name': 'William', 'middle_name': 'Kester', 'last_name': 'Nash', 'is_contact_pi': True, 'full_name': 'William Kester Nash', 'title': 'PI'}]","[{'first_name': 'AMELIA', 'middle_name': 'JACKSON', 'last_name': 'PEARSON', 'full_name': 'AMELIA JACKSON PEARSON'}]","{'code': 'ES', 'abbreviation': 'NIEHS', 'name': 'National Institute of Environmental Health Sciences'}","[{'fy': 2025, 'code': 'ES', 'name': 'National Institute of Environmental Health Sciences', 'abbreviation': 'NIEHS', 'total_cost': 631279.0, 'direct_cost_ic': 620794.0, 'indirect_cost_ic': 10485.0}]",ME-01,2025-09-08T00:00:00,2030-07-31T00:00:00,"{'name': 'Other Domestic Non-Profits', 'code': 'NP', 'is_other': False}",RFA-ES-24-002,"{'srg_code': 'ZES1', 'srg_flex': None, 'sra_designator_code': 'LWJ', 'sra_flex_code': 'S', 'group_code': 'WT', 'name': 'Special Emphasis Panel[ZES1 LWJ-S (WT)]'}",2025-09-05T00:00:00,UH4ES037498,Advisory Committees;Area;Award;Collaborations;Communities;Complex;Contractor;Country;Data;Data Management Resources;Decontamination;Department of Energy;Educational Curriculum;Educational Technology;Emergency Situation;Emergency response;Evaluation;Exposure to;Funding;Goals;Government;Grant;Hazardous Substances;Hazardous Waste;Hazardous Waste Sites;Health;Hour;Human Resources;Industrialization;Knowledge;Laboratories;Leadership;Mediating;National Institute of Environmental Health Sciences;Nuclear Weapon;Nuclear Weapons Testings;Privatization;Production;Quality Control;Radioactive;Rain;Research;Research Institute;Safety;Site;Statutes and Laws;Students;Time;Training;Training Programs;Transportation;Waste Management;Work;Workplace;chemical disaster;community college;cost effective;flexibility;improved;meetings;member;online delivery;operation;response;restoration;skills;student training;success;technical college;virtual;wasting,Nat. PETE HAZMAT Training Initiative at DOE Nuclear Weapons Complex,"Narrative
 The Department of Energy and predecessor agencies have been involved in the
research, production and testing of nuclear weapons since the 1940s. During that time,
numerous facilities, both government and privately-owned, were constructed or leased
across the country to support the effort, generating large quantities of radioactive and
hazardous materials that resulted in the contamination of many of the facilities and
surrounding areas.
 In 1994, to protect the staff and workers doing DOE cleanup and waste
management work, legislation was enacted to allow the Department of Energy to fund
NIEHS to develop Worker Training programs that would assure workers, other facility
personnel, and community responders the knowledge and skills to protect themselves
and their communities from hazardous conditions in the workplace.
 The Community College Consortium for Health and Safety Training (CCCHST)
has been continuously supported by NIEHS since 1995 to provide quality training that is
efficient, consistent, flexible, and cost-effective for the multiple tiers of contractors at
DOE sites including the Oakridge complex, Portsmouth, Pantex, the Savannah River
Site, and Los Alamos National Lab and in 2026 CCCHST will provide 3,500 students
with 350 courses for a total 35,000 contact hours of training, with an average 75 courses
delivered online.",,N,2025-09-08T00:00:00,2026-07-31T00:00:00,93.142,Other,620794.0,10485.0
11227090,,2025,1R01AR084523-01A1,AR084523,"{'org_name': 'UNIVERSITY OF MAINE ORONO', 'city': None, 'country': None, 'org_city': 'ORONO', 'org_country': 'UNITED STATES', 'org_state': 'ME', 'org_state_name': None, 'dept_type': 'BIOLOGY', 'fips_country_code': None, 'org_duns': ['186875787'], 'org_ueis': ['PB3AJE5ZEJ59'], 'primary_duns': '186875787', 'primary_uei': 'PB3AJE5ZEJ59', 'org_fips': 'US', 'org_ipf_code': '3833403', 'org_zipcode': '044695717', 'external_org_id': 3833403}",1,R01,471513.0,"{'appl_type_code': '1', 'activity_code': 'R01', 'ic_code': 'AR', 'serial_num': '084523', 'support_year': '01', 'full_support_year': '01A1', 'suffix_code': 'A1'}","[{'profile_id': 2107057, 'first_name': 'Clarissa', 'middle_name': 'A', 'last_name': 'Henry', 'is_contact_pi': True, 'full_name': 'Clarissa A Henry', 'title': 'ASSOCIATE PROFESSOR'}]","[{'first_name': 'EMILY', 'middle_name': 'FORAN', 'last_name': 'CARIFI', 'full_name': 'EMILY FORAN CARIFI'}]","{'code': 'AR', 'abbreviation': 'NIAMS', 'name': 'National Institute of Arthritis and Musculoskeletal and Skin Diseases'}","[{'fy': 2025, 'code': 'AR', 'name': 'National Institute of Arthritis and Musculoskeletal and Skin Diseases', 'abbreviation': 'NIAMS', 'total_cost': 471513.0, 'direct_cost_ic': 356908.0, 'indirect_cost_ic': 114605.0}]",,2025-09-05T00:00:00,2030-08-31T00:00:00,"{'name': 'EARTH SCIENCES/RESOURCES', 'code': '10', 'is_other': False}",PA-20-185,"{'srg_code': 'SMEP', 'srg_flex': None, 'sra_designator_code': None, 'sra_flex_code': None, 'group_code': None, 'name': 'Skeletal Muscle and Exercise Physiology Study Section[SMEP]'}",2025-09-04T00:00:00,R01AR084523,Action Potentials;Adhesions;Affect;Binding;Cell-Matrix Junction;Cellular biology;Cessation of life;Clinical;Complex;Data;Degenerative Disorder;Development;Disease;Disease Progression;Dystroglycan;Dystrophin;Embryonic Development;Extracellular Matrix;Failure to Thrive;Future;Genes;Genetic;Genetic Models;Glycoproteins;Growth;Homeostasis;Human;Hyperplasia;Hypertrophy;Joints;Life Expectancy;Maintenance;Mannose;Mediating;Membrane;Microscopy;Modeling;Molecular;Motor Neurons;Muscle;Muscle Contraction;Muscle Fibers;Musculoskeletal;Mutation;Neurodegenerative Disorders;Neuromuscular Junction;Phenocopy;Phenotype;Play;Postsynaptic Membrane;Proteins;Quality of life;Resolution;Role;Signal Transduction;Skeletal Muscle;Skeletal system;Skeleton;System;Tendon structure;Testing;Tissues;Zebrafish;cell type;dystroglycanopathy;experimental study;glycosylation;imaging approach;imaging study;inorganic phosphate;insight;life span;mosaic analysis;muscle degeneration;mutant;neuromuscular;neuromusculoskeletal;receptor;serial imaging;single molecule;therapeutic target;transcriptome sequencing;transmission process,Tissue-specific roles for muscle-matrix adhesion in neuromuscular development and homeostasis,"Dystroglycanopathies are clinically heterogeneous, multisystem disorders that can lead to severe progressive
neuromuscular degeneration, which deleteriously impacts quality of life and is frequently lethal. There are no
cures. We aim to use the advantages of the zebrafish model to shed light on how different tissues impact
neuromuscular degeneration and how embryonic development affects disease progression.",,N,2025-09-05T00:00:00,2026-08-31T00:00:00,93.846,Non-SBIR/STTR,356908.0,114605.0
11230816,,2025,1R21AG096415-01,AG096415,"{'org_name': 'JACKSON LABORATORY', 'city': None, 'country': None, 'org_city': 'BAR HARBOR', 'org_country': 'UNITED STATES', 'org_state': 'ME', 'org_state_name': None, 'dept_type': None, 'fips_country_code': None, 'org_duns': ['042140483'], 'org_ueis': ['XR6LMXNKDJJ1'], 'primary_duns': '042140483', 'primary_uei': 'XR6LMXNKDJJ1', 'org_fips': 'US', 'org_ipf_code': '7096501', 'org_zipcode': '046091523', 'external_org_id': 7096501}",1,R21,486750.0,"{'appl_type_code': '1', 'activity_code': 'R21', 'ic_code': 'AG', 'serial_num': '096415', 'support_year': '01', 'full_support_year': '01', 'suffix_code': ''}","[{'profile_id': 14453876, 'first_name': 'Maria', 'middle_name': '', 'last_name': 'Telpoukhovskaia', 'is_contact_pi': True, 'full_name': 'Maria  Telpoukhovskaia', 'title': 'ASSOCIATE RESEARCH SCIENTIST'}]","[{'first_name': 'MAJA', 'middle_name': '', 'last_name': 'MARIC', 'full_name': 'MAJA  MARIC'}]","{'code': 'AG', 'abbreviation': 'NIA', 'name': 'National Institute on Aging'}","[{'fy': 2025, 'code': 'AG', 'name': 'National Institute on Aging', 'abbreviation': 'NIA', 'total_cost': 486750.0, 'direct_cost_ic': 275000.0, 'indirect_cost_ic': 211750.0}]",ME-02,2025-09-01T00:00:00,2027-08-31T00:00:00,"{'name': 'Research Institutes', 'code': '20', 'is_other': False}",PAR-22-094,"{'srg_code': 'ZRG1', 'srg_flex': None, 'sra_designator_code': 'AN', 'sra_flex_code': 'Z', 'group_code': '55', 'name': 'Special Emphasis Panel[ZRG1 AN-Z (55)]'}",2025-08-27T00:00:00,R21AG096415,AD transgenic mice;Age;Age Months;Aging;Alzheimer's Disease;Alzheimer's disease model;Alzheimer's disease pathology;Amyloid;Amyloid deposition;B-Lymphocytes;Behavior;Benchmarking;Blood;Blood Cells;Brain;Brain Pathology;Caregivers;Cell Lineage;Cell Physiology;Cell Transplantation;Cells;Central Nervous System;Circulation;Clinical;Clonal Hematopoietic Stem Cell;Collaborations;DNMT3a;Dementia;Development;Dioxygenases;Disease;Disease Progression;Etiology;Flow Cytometry;Foundations;Functional disorder;Future;Genes;Gliosis;Goals;Hematopoietic;Hematopoietic System;Hematopoietic stem cells;Human;Immune;Immune System Diseases;Immune response;Immunohistochemistry;Impaired cognition;Incidence;Individual;Infiltration;Intervention;Label;Link;Location;Modeling;Mus;Mutate;Mutation;Neurofibrillary Tangles;Onset of illness;Pathogenesis;Pathology;Patients;Peripheral;Phenotype;Population Study;Prevention;Reporting;Research;Senile Plaques;Severities;Societies;Somatic Mutation;T-Lymphocyte;Tetanus Helper Peptide;Therapeutic Intervention;Time;Validation;Work;age effect;age related;aging brain;amyloid pathology;brain dysfunction;brain tissue;cell motility;cell type;chemokine receptor;clonal hematopoiesis;high risk;immune cell infiltrate;innovation;middle age;minimally invasive;monocyte;mouse model;mutant;neurofibrillary tangle formation;neutrophil;novel;novel therapeutics;peripheral blood;precision medicine;prevent;protective factors;resilience;stem cell population;therapeutic candidate;therapeutically effective,Impact of Age-Related Clonal Hematopoiesis on Alzheimer's Disease,"PROJECT NARRATIVE
Alzheimer's disease (AD) has a devastating effect on patients, caregivers, and society, and effective therapeutic
interventions are urgently needed to prevent and cure dementia. An age-related blood phenomenon called clonal
hematopoiesis (CH) was recently identified as a potential protective factor for AD in a population study; however,
validation and mechanistic studies are not possible in humans. Our project will model CH and AD in mice to
uncover mechanistic links between peripheral blood and brain dysfunction and nominate new resilience and
protective targets for AD.",,N,2025-09-01T00:00:00,2027-08-31T00:00:00,93.866,Non-SBIR/STTR,275000.0,211750.0
11223487,,2025,1R01DK141613-01A1,DK141613,"{'org_name': 'MAINEHEALTH', 'city': None, 'country': None, 'org_city': 'PORTLAND', 'org_country': 'UNITED STATES', 'org_state': 'ME', 'org_state_name': None, 'dept_type': None, 'fips_country_code': None, 'org_duns': ['071732663'], 'org_ueis': ['MAYKB1LWD5U9'], 'primary_duns': '071732663', 'primary_uei': 'MAYKB1LWD5U9', 'org_fips': 'US', 'org_ipf_code': '4757601', 'org_zipcode': '041023175', 'external_org_id': 4757601}",1,R01,2608068.0,"{'appl_type_code': '1', 'activity_code': 'R01', 'ic_code': 'DK', 'serial_num': '141613', 'support_year': '01', 'full_support_year': '01A1', 'suffix_code': 'A1'}","[{'profile_id': 14977988, 'first_name': 'Ziru', 'middle_name': '', 'last_name': 'Li', 'is_contact_pi': True, 'full_name': 'Ziru  Li', 'title': ''}]","[{'first_name': 'SAUL', 'middle_name': 'N', 'last_name': 'MALOZOWSKI', 'full_name': 'SAUL N MALOZOWSKI'}]","{'code': 'DK', 'abbreviation': 'NIDDK', 'name': 'National Institute of Diabetes and Digestive and Kidney Diseases'}","[{'fy': 2025, 'code': 'DK', 'name': 'National Institute of Diabetes and Digestive and Kidney Diseases', 'abbreviation': 'NIDDK', 'total_cost': 2608068.0, 'direct_cost_ic': 1481856.0, 'indirect_cost_ic': 1126212.0}]",ME-01,2025-09-01T00:00:00,2029-08-31T00:00:00,"{'name': 'Independent Hospitals', 'code': '30', 'is_other': False}",PA-20-185,"{'srg_code': 'ZRG1', 'srg_flex': None, 'sra_designator_code': 'MSOS', 'sra_flex_code': 'A', 'group_code': '03', 'name': 'Special Emphasis Panel[ZRG1 MSOS-A (03)]'}",2025-09-01T00:00:00,R01DK141613,Ablation;Adipose tissue;Adult;Affect;Anatomy;Anti-Obesity Agents;Body Weight;Body Weight decreased;Bone Density;Bone Marrow;Bone remodeling;Cardiovascular Diseases;Cells;Clinical Management;Consumption;Data;Dietary Calcium;Endocrine;Endocrine Glands;Equilibrium;Estrogen deficiency;Excision;Exercise;FRAP1 gene;Factor X;Fatty Liver;Femur;GLP-I receptor;Gastrectomy;Gastric Glands;Gastric mucosa;Gastrins;Genetic;Health;Hip region structure;Homeostasis;Hormonal;Hormones;Human;Impairment;In Vitro;Islets of Langerhans;Lipids;Liver;Malignant Neoplasms;Malnutrition;Mechanics;Mediating;Mediator;Metabolic;Metabolic Bone Diseases;Metabolic Diseases;Metabolic stress;Modeling;Molecular;Monitor;Morbid Obesity;Mucous Membrane;Mus;Neck;Non-Insulin-Dependent Diabetes Mellitus;Obesity;Operative Surgical Procedures;Osteoblasts;Osteoclasts;Osteogenesis;Osteoporosis;Ovariectomy;Patients;Physiology;Prevention strategy;Procedures;Production;Proteins;Proteomics;Rab27a protein;Research;Rodent;Role;Secondary to;Signal Pathway;Signal Transduction;Somatostatin;Source;Stomach;Supplementation;Testing;Thinness;Time;Vesicle;Vitamin D;Weight-Bearing state;Work;adipocyte differentiation;bariatric surgery;bone;bone loss;bone loss prevention;bone mass;bone metabolism;bone preservation;design;diet-induced obesity;exosome;extracellular vesicles;fracture risk;ghrelin;glucose metabolism;high risk;improved;innovation;insight;lipid biosynthesis;lipid metabolism;male;malignant stomach neoplasm;metabolic phenotype;microbiota;mouse model;neglect;new therapeutic target;novel;obese patients;obese person;osteoclastogenesis;osteogenic;pandemic disease;prevent;protein transport;quality of life improvement;rab GTP-Binding Proteins;secretory protein;side effect;skeletal;substantia spongiosa,Gastric Endocrine Functions in Skeletal Homeostasis,"Project Narrative
Bariatric surgery leads to durable weight loss, enhances quality of life and improves metabolic health; however,
bone loss is a side effect. This project uses innovative genetic mouse models to define novel molecular
signaling pathways between the gut and the bone that impact skeletal health, targeting endocrine cells in the
stomach. This work will define novel functions of gastric endocrine cells and broadly apply to metabolic bone
disorders and osteoporosis.",,N,2025-09-01T00:00:00,2029-08-31T00:00:00,93.847,Non-SBIR/STTR,1481856.0,1126212.0
