appl_id,subproject_id,fiscal_year,project_num,project_serial_num,organization,award_type,activity_code,award_amount,project_num_split,principal_investigators,program_officers,agency_ic_admin,agency_ic_fundings,cong_dist,project_start_date,project_end_date,organization_type,opportunity_number,full_study_section,award_notice_date,core_project_num,pref_terms,project_title,phr_text,spending_categories_desc,arra_funded,budget_start,budget_end,cfda_code,funding_mechanism,direct_cost_amt,indirect_cost_amt
11099960,,2025,5R01EY035397-02,EY035397,"{'org_name': 'JACKSON LABORATORY', 'city': None, 'country': None, 'org_city': 'BAR HARBOR', 'org_country': 'UNITED STATES', 'org_state': 'ME', 'org_state_name': None, 'dept_type': None, 'fips_country_code': None, 'org_duns': ['042140483'], 'org_ueis': ['XR6LMXNKDJJ1'], 'primary_duns': '042140483', 'primary_uei': 'XR6LMXNKDJJ1', 'org_fips': 'US', 'org_ipf_code': '7096501', 'org_zipcode': '046091523', 'external_org_id': 7096501}",5,R01,728017.0,"{'appl_type_code': '5', 'activity_code': 'R01', 'ic_code': 'EY', 'serial_num': '035397', 'support_year': '02', 'full_support_year': '02', 'suffix_code': ''}","[{'profile_id': 1868717, 'first_name': 'Patsy', 'middle_name': 'M', 'last_name': 'Nishina', 'is_contact_pi': True, 'full_name': 'Patsy M Nishina', 'title': 'PROFESSOR'}]","[{'first_name': 'TIFFANY', 'middle_name': '', 'last_name': 'COOK', 'full_name': 'TIFFANY  COOK'}]","{'code': 'EY', 'abbreviation': 'NEI', 'name': 'National Eye Institute'}","[{'fy': 2025, 'code': 'EY', 'name': 'National Eye Institute', 'abbreviation': 'NEI', 'total_cost': 728017.0, 'direct_cost_ic': 411309.0, 'indirect_cost_ic': 316708.0}]",ME-02,2024-06-01T00:00:00,2029-05-31T00:00:00,"{'name': 'Research Institutes', 'code': '20', 'is_other': False}",PA-20-185,"{'srg_code': 'PED2', 'srg_flex': None, 'sra_designator_code': None, 'sra_flex_code': None, 'group_code': None, 'name': 'Pathophysiology of Eye Disease - 2 Study Section[PED2]'}",2025-08-04T00:00:00,R01EY035397,10q26;3' Untranslated Regions;Address;Adhesions;Affect;Age related macular degeneration;Alleles;Animal Model;Biochemical;Blindness;Blood-Retinal Barrier;CRISPR/Cas technology;Candidate Disease Gene;Cell Adhesion;Cell Proliferation;Cells;Cellular Morphology;Clinical;Complement Factor H;Consumption;Deposition;Development;Diet;Disease;Elements;Environmental Risk Factor;Epithelium;Evaluation;Extracellular Matrix;Eye;Frequencies;Gene Expression;Genes;Genetic;Genetic Crosses;Goals;High Fat Diet;Histologic;Homeostasis;Human;Individual;Inflammatory;Intermediate Filaments;Lead;Learning;Link;Linkage Disequilibrium;Lipids;Mediating;Mesenchymal;Mitochondria;Modeling;Modification;Molecular;Mus;Mutation;Nonexudative age-related macular degeneration;Oxidative Stress Induction;Pathogenicity;Pathologic;Pathology;Pathway interactions;Phenotype;Pigmentation physiologic function;Precipitating Factors;Primates;Proteomics;Research Personnel;Resources;Retinal Degeneration;Risk;Risk Factors;Role;Severity of illness;Structure;Structure of retinal pigment epithelium;Susceptibility Gene;Testing;Tissues;Twin Studies;Uncertainty;Variant;Visual impairment;aging population;cell type;comparison control;complement pathway;cost;disease phenotype;disease-causing mutation;disorder risk;effective therapy;genetic variant;genome editing;genome wide association study;genome-wide;genome-wide analysis;human population study;in vivo;insertion/deletion mutation;macula;macular dystrophy;metabolomics;mitochondrial dysfunction;mouse model;prevent;risk variant;therapeutic evaluation;transcriptomics;trend;western diet,Role of ARMS2 mutations in age-related macular degeneration,"PROJECT NARRATIVE
The Chr10q26 locus, containing ARMS2/HTRA1, has been found in large scale human population studies to
contribute to a significant proportion of the risk for developing age-related macular degeneration (AMD), one of
the leading causes of vision impairment and loss in the aging population. Due to strong linkage disequilbrium
between the two genes, it is still unclear which gene (or both) contribute to the increased risk. In this application,
we plan to further determine if the disease phenotypes observed in mice bearing an ARMS2A69S allele might be
due to reduction in the integrity of the outer blood retinal barrier or to mitochondrial dysfunction and determine
whether environmental factors such as consumption of a high fat diet, or genetic factors such as rare human
complement factor H disease alleles exacerbate the disease in ARMS2A69S mice.",,N,2025-06-01T00:00:00,2026-05-31T00:00:00,93.867,Non-SBIR/STTR,411309.0,316708.0
10849536,,2024,1R16NS140309-01,NS140309,"{'org_name': 'UNIVERSITY OF NEW ENGLAND', 'city': None, 'country': None, 'org_city': 'BIDDEFORD', 'org_country': 'UNITED STATES', 'org_state': 'ME', 'org_state_name': None, 'dept_type': 'OTHER BASIC SCIENCES', 'fips_country_code': None, 'org_duns': ['071735252'], 'org_ueis': ['HVE6K4YS3B51'], 'primary_duns': '071735252', 'primary_uei': 'HVE6K4YS3B51', 'org_fips': 'US', 'org_ipf_code': '1197101', 'org_zipcode': '040059526', 'external_org_id': 1197101}",1,R16,142000.0,"{'appl_type_code': '1', 'activity_code': 'R16', 'ic_code': 'NS', 'serial_num': '140309', 'support_year': '01', 'full_support_year': '01', 'suffix_code': ''}","[{'profile_id': 6691651, 'first_name': 'RUSSELL', 'middle_name': 'JAMES', 'last_name': 'FERLAND', 'is_contact_pi': True, 'full_name': 'RUSSELL JAMES FERLAND', 'title': ''}]","[{'first_name': 'SEVERN', 'middle_name': 'BORDEN', 'last_name': 'CHURN', 'full_name': 'SEVERN BORDEN CHURN'}]","{'code': 'NS', 'abbreviation': 'NINDS', 'name': 'National Institute of Neurological Disorders and Stroke'}","[{'fy': 2024, 'code': 'NS', 'name': 'National Institute of Neurological Disorders and Stroke', 'abbreviation': 'NINDS', 'total_cost': 142000.0, 'direct_cost_ic': 100000.0, 'indirect_cost_ic': 42000.0}]",ME-01,2024-06-01T00:00:00,2028-05-31T00:00:00,"{'name': 'SCHOOLS OF OSTEOPATHIC MEDICINE', 'code': '10', 'is_other': False}",PAR-21-169,"{'srg_code': 'ZGM1', 'srg_flex': None, 'sra_designator_code': 'RCB', 'sra_flex_code': 'W', 'group_code': 'SU', 'name': 'Special Emphasis Panel[ZGM1 RCB-W (SU)]'}",2024-05-30T00:00:00,R16NS140309,Age;Anatomy;Animal Model;Area;Behavior;Behavioral;Brain;Brain Stem;Cardiovascular system;Cell Nucleus;Cessation of life;Clinical Research;Clonic Seizure;Complex;Convulsants;Critical Pathways;Data;Epilepsy;Epileptogenesis;Event;Exposure to;Fiber;Flurothyl;Gatekeeping;Gene Deletion;Gene Expression;Gene Proteins;Generalized Epilepsy;Generalized seizures;Genes;Genetic;Genetic Transcription;Genomics;Glutamate Transporter;Glutamates;Goals;Hippocampus;Human;Hypothalamic structure;Incubated;Individual;Inhalation Exposure;Lesion;Mediating;Modeling;Molecular;Mus;Neuroanatomy;Neurons;Outcome;Pathogenesis;Pathway Analysis;Pathway interactions;Phase;Population;Pre-Clinical Model;Prevention strategy;Probability;Process;Prosencephalon;Quantitative Reverse Transcriptase PCR;Research;Rest;Risk;Role;Seizures;Signal Pathway;Signal Transduction;Stains;Synaptic Vesicles;System;Techniques;Testing;Therapeutic;Therapeutic Intervention;Time;Tonic Seizures;Work;brain abnormalities;cell type;digital;druggable target;experience;human model;insight;nano-string;novel;novel strategies;overexpression;presynaptic;prevent;preventable epilepsy;protein expression;respiratory;response;sudden unexpected death in epilepsy;symptom management;targeted treatment;therapy development;transcriptome;transcriptomics;treatment strategy,The Role of the Ventromedial Nucleus of the Hypothalamus in Epileptogenesis,"Project Narrative
While current therapeutic approaches for epilepsy primarily focus on symptom management and seizure suppression,
there remains a critical gap in targeting the underlying processes of brain reorganization (epileptogenesis) in individuals
with epilepsy. The primary goals of this study encompass the following objectives: 1) identifying neuroanatomical and
molecular mechanisms by which the ventromedial nucleus of the hypothalamus (VMH) is involved in epileptogenic
processes and 2) determining the genomic landscape of the epileptogenic processes in the VMH using spatial
transcriptomics. By elucidating mechanisms and signaling pathways regulating the reorganizational processes in the VMH
that lead to brainstem-tonic seizures and increased risk for Sudden Unexpected Death in EPilepsy (SUDEP), potential
druggable targets for epilepsy and/or SUDEP can be identified.",Brain Disorders; Building Research Capacity at Institutions with Limited NIH Funding; Epilepsy; Neurodegenerative; Neurosciences,N,2024-06-01T00:00:00,2025-05-31T00:00:00,93.853,Non-SBIR/STTR,100000.0,42000.0
11098617,,2025,5R16NS140309-02,NS140309,"{'org_name': 'UNIVERSITY OF NEW ENGLAND', 'city': None, 'country': None, 'org_city': 'BIDDEFORD', 'org_country': 'UNITED STATES', 'org_state': 'ME', 'org_state_name': None, 'dept_type': 'OTHER BASIC SCIENCES', 'fips_country_code': None, 'org_duns': ['071735252'], 'org_ueis': ['HVE6K4YS3B51'], 'primary_duns': '071735252', 'primary_uei': 'HVE6K4YS3B51', 'org_fips': 'US', 'org_ipf_code': '1197101', 'org_zipcode': '040059526', 'external_org_id': 1197101}",5,R16,142000.0,"{'appl_type_code': '5', 'activity_code': 'R16', 'ic_code': 'NS', 'serial_num': '140309', 'support_year': '02', 'full_support_year': '02', 'suffix_code': ''}","[{'profile_id': 6691651, 'first_name': 'RUSSELL', 'middle_name': 'JAMES', 'last_name': 'FERLAND', 'is_contact_pi': True, 'full_name': 'RUSSELL JAMES FERLAND', 'title': ''}]","[{'first_name': 'SEVERN', 'middle_name': 'BORDEN', 'last_name': 'CHURN', 'full_name': 'SEVERN BORDEN CHURN'}]","{'code': 'NS', 'abbreviation': 'NINDS', 'name': 'National Institute of Neurological Disorders and Stroke'}","[{'fy': 2025, 'code': 'NS', 'name': 'National Institute of Neurological Disorders and Stroke', 'abbreviation': 'NINDS', 'total_cost': 142000.0, 'direct_cost_ic': 100000.0, 'indirect_cost_ic': 42000.0}]",ME-01,2024-06-01T00:00:00,2028-05-31T00:00:00,"{'name': 'SCHOOLS OF OSTEOPATHIC MEDICINE', 'code': '10', 'is_other': False}",PAR-21-169,"{'srg_code': 'ZGM1', 'srg_flex': None, 'sra_designator_code': 'RCB', 'sra_flex_code': 'W', 'group_code': 'SU', 'name': 'ZGM1-RCB-W(SU)'}",2025-05-12T00:00:00,R16NS140309,Age;Anatomy;Animal Model;Area;Behavior;Behavioral;Brain;Brain Stem;Cardiovascular system;Cell Nucleus;Cessation of life;Clinical Research;Clonic Seizure;Complex;Convulsants;Critical Pathways;Data;Epilepsy;Epileptogenesis;Event;Exposure to;Fiber;Flurothyl;Gatekeeping;Gene Deletion;Gene Expression;Gene Proteins;Generalized Epilepsy;Generalized seizures;Genes;Genetic;Genetic Transcription;Genomics;Glutamate Transporter;Glutamates;Goals;Hippocampus;Human;Hypothalamic structure;Incubated;Individual;Inhalation Exposure;Lesion;Mediating;Modeling;Molecular;Mus;Neuroanatomy;Neurons;Outcome;Pathogenesis;Pathway Analysis;Pathway interactions;Phase;Population;Pre-Clinical Model;Prevention strategy;Probability;Process;Prosencephalon;Quantitative Reverse Transcriptase PCR;Research;Rest;Risk;Role;Seizures;Signal Pathway;Signal Transduction;Stains;Synaptic Vesicles;System;Techniques;Testing;Therapeutic;Therapeutic Intervention;Time;Tonic Seizures;Work;brain abnormalities;cell type;digital;druggable target;experience;human model;insight;nanostring;novel;novel strategies;overexpression;presynaptic;prevent;preventable epilepsy;protein expression;respiratory;response;spatial transcriptomics;sudden unexpected death in epilepsy;symptom management;targeted treatment;therapy development;transcriptome;treatment strategy,The Role of the Ventromedial Nucleus of the Hypothalamus in Epileptogenesis,"Project Narrative
While current therapeutic approaches for epilepsy primarily focus on symptom management and seizure suppression,
there remains a critical gap in targeting the underlying processes of brain reorganization (epileptogenesis) in individuals
with epilepsy. The primary goals of this study encompass the following objectives: 1) identifying neuroanatomical and
molecular mechanisms by which the ventromedial nucleus of the hypothalamus (VMH) is involved in epileptogenic
processes and 2) determining the genomic landscape of the epileptogenic processes in the VMH using spatial
transcriptomics. By elucidating mechanisms and signaling pathways regulating the reorganizational processes in the VMH
that lead to brainstem-tonic seizures and increased risk for Sudden Unexpected Death in EPilepsy (SUDEP), potential
druggable targets for epilepsy and/or SUDEP can be identified.",,N,2025-06-01T00:00:00,2026-05-31T00:00:00,93.853,Non-SBIR/STTR,100000.0,42000.0
11143295,,2025,5R37NS054154-16,NS054154,"{'org_name': 'JACKSON LABORATORY', 'city': None, 'country': None, 'org_city': 'BAR HARBOR', 'org_country': 'UNITED STATES', 'org_state': 'ME', 'org_state_name': None, 'dept_type': None, 'fips_country_code': None, 'org_duns': ['042140483'], 'org_ueis': ['XR6LMXNKDJJ1'], 'primary_duns': '042140483', 'primary_uei': 'XR6LMXNKDJJ1', 'org_fips': 'US', 'org_ipf_code': '7096501', 'org_zipcode': '046091523', 'external_org_id': 7096501}",5,R37,784528.0,"{'appl_type_code': '5', 'activity_code': 'R37', 'ic_code': 'NS', 'serial_num': '054154', 'support_year': '16', 'full_support_year': '16', 'suffix_code': ''}","[{'profile_id': 1881305, 'first_name': 'Robert', 'middle_name': 'W.', 'last_name': 'Burgess', 'is_contact_pi': True, 'full_name': 'Robert W. Burgess', 'title': 'PROFESSOR'}]","[{'first_name': 'GLEN', 'middle_name': 'H', 'last_name': 'NUCKOLLS', 'full_name': 'GLEN H NUCKOLLS'}]","{'code': 'NS', 'abbreviation': 'NINDS', 'name': 'National Institute of Neurological Disorders and Stroke'}","[{'fy': 2025, 'code': 'NS', 'name': 'National Institute of Neurological Disorders and Stroke', 'abbreviation': 'NINDS', 'total_cost': 784528.0, 'direct_cost_ic': 443236.0, 'indirect_cost_ic': 341292.0}]",ME-02,2024-06-01T00:00:00,2027-05-31T00:00:00,"{'name': 'Research Institutes', 'code': '20', 'is_other': False}",PA-19-056,"{'srg_code': None, 'srg_flex': None, 'sra_designator_code': None, 'sra_flex_code': None, 'group_code': None, 'name': None}",2025-06-04T00:00:00,R37NS054154,Affect;Afferent Neurons;Affinity;Agreement;Alleles;Amino Acids;Amino Acyl-tRNA Synthetases;Award;Biochemical;Biochemistry;Biological;Cell Differentiation process;Cells;Cellular biology;Charcot-Marie-Tooth Disease;Charge;Chronic;Clinical;Code;Codon Nucleotides;Collaborations;Collection;DNA cassette;Data;Development;Disease;Down-Regulation;EEF1A1 gene;Engineering;Enzymes;Funding;Future;Gene Family;Genes;Genetic;Genetic study;Germ Lines;Glycine-Specific tRNA;Goals;Health Sciences;Hereditary Disease;Human;Human Cell Line;Inherited;Kinetics;Knockout Mice;Lead;Ligase;Measures;Modeling;Molecular Genetics;Motor Neurons;Mouse Cell Line;Mus;Mutation;Nerve;Neurodegenerative Disorders;Neuromuscular Junction;Neuropathy;Outcome;Pathogenicity;Patients;Peripheral Nervous System Diseases;Persons;Pharmacotherapy;Phenotype;Phosphotransferases;Predisposition;Progress Reports;Reaction;Research;Ribosomes;Severities;Severity of illness;Site;Specificity;System;Testing;Therapeutic;Transfer RNA;Transfer RNA Aminoacylation;Transgenes;Transgenic Organisms;Translations;Tyrosine-Specific tRNA;Tyrosine-tRNA Ligase;Upregulation;Validation;Variant;Work;adeno-associated virus 9 delivery;biological adaptation to stress;cell type;disease model;dominant genetic mutation;experimental study;gene therapy;human induced pluripotent stem cells;in vivo;inducible Cre;industry partner;inhibitor;mouse model;mutant;novel;overexpression;pharmacologic;preclinical development;prevent;translational potential;treatment strategy;vector,The Genetics of the Neuromuscular Junction: Mechanisms and Disease Models,Charcot-Marie-Tooth disease affects approximately 1:2500 people and the largest family of genes associated with this disorder is the tRNA-synthetases. How mutations in these ubiquitous genes lead to the degeneration of specific nerves is unknown. We are exploring the biochemical and cell biological basis of these disorders using mice and human cell lines engineered to model patient mutations; this work will also test both pharmacological and gene therapy treatment strategies.,,N,2025-06-01T00:00:00,2026-05-31T00:00:00,93.853,Non-SBIR/STTR,443236.0,341292.0
11065080,,2024,4R37NS054154-15,NS054154,"{'org_name': 'JACKSON LABORATORY', 'city': None, 'country': None, 'org_city': 'BAR HARBOR', 'org_country': 'UNITED STATES', 'org_state': 'ME', 'org_state_name': None, 'dept_type': None, 'fips_country_code': None, 'org_duns': ['042140483'], 'org_ueis': ['XR6LMXNKDJJ1'], 'primary_duns': '042140483', 'primary_uei': 'XR6LMXNKDJJ1', 'org_fips': 'US', 'org_ipf_code': '7096501', 'org_zipcode': '046091523', 'external_org_id': 7096501}",4N,R37,784528.0,"{'appl_type_code': '4', 'activity_code': 'R37', 'ic_code': 'NS', 'serial_num': '054154', 'support_year': '15', 'full_support_year': '15', 'suffix_code': ''}","[{'profile_id': 1881305, 'first_name': 'Robert', 'middle_name': 'W.', 'last_name': 'Burgess', 'is_contact_pi': True, 'full_name': 'Robert W. Burgess', 'title': 'PROFESSOR'}]","[{'first_name': 'GLEN', 'middle_name': 'H', 'last_name': 'NUCKOLLS', 'full_name': 'GLEN H NUCKOLLS'}]","{'code': 'NS', 'abbreviation': 'NINDS', 'name': 'National Institute of Neurological Disorders and Stroke'}","[{'fy': 2024, 'code': 'NS', 'name': 'National Institute of Neurological Disorders and Stroke', 'abbreviation': 'NINDS', 'total_cost': 784528.0, 'direct_cost_ic': 443236.0, 'indirect_cost_ic': 341292.0}]",ME-02,2024-06-01T00:00:00,2027-05-31T00:00:00,"{'name': 'Research Institutes', 'code': '20', 'is_other': False}",PAR-23-022,"{'srg_code': None, 'srg_flex': None, 'sra_designator_code': None, 'sra_flex_code': None, 'group_code': None, 'name': None}",2024-07-23T00:00:00,R37NS054154,Affect;Afferent Neurons;Affinity;Agreement;Alleles;Amino Acids;Amino Acyl-tRNA Synthetases;Award;Biochemical;Biochemistry;Biological;Cell Differentiation process;Cells;Cellular biology;Charcot-Marie-Tooth Disease;Charge;Chronic;Clinical;Code;Codon Nucleotides;Collaborations;Collection;DNA cassette;Data;Development;Disease;Down-Regulation;EEF1A1 gene;Engineering;Enzymes;Funding;Future;Gene Family;Genes;Genetic;Genetic study;Germ Lines;Glycine-Specific tRNA;Goals;Health Sciences;Hereditary Disease;Human;Human Cell Line;Inherited;Kinetics;Knockout Mice;Lead;Ligase;Measures;Modeling;Molecular Genetics;Motor Neurons;Mouse Cell Line;Mus;Mutation;Nerve;Neurodegenerative Disorders;Neuromuscular Junction;Neuropathy;Outcome;Pathogenicity;Patients;Peripheral Nervous System Diseases;Persons;Phenotype;Phosphotransferases;Predisposition;Progress Reports;Reaction;Research;Ribosomes;Severities;Severity of illness;Site;Specificity;System;Testing;Therapeutic;Transfer RNA;Transfer RNA Aminoacylation;Transgenes;Transgenic Organisms;Translations;Tyrosine-Specific tRNA;Tyrosine-tRNA Ligase;Up-Regulation;Validation;Variant;Work;adeno-associated virus 9 delivery;biological adaptation to stress;cell type;disease model;dominant genetic mutation;experimental study;gene therapy;human induced pluripotent stem cells;in vivo;inducible Cre;industry partner;inhibitor;mouse model;mutant;novel;overexpression;pharmacologic;preclinical development;prevent;translational potential;treatment strategy;vector,The Genetics of the Neuromuscular Junction: Mechanisms and Disease Models,Charcot-Marie-Tooth disease affects approximately 1:2500 people and the largest family of genes associated with this disorder is the tRNA-synthetases. How mutations in these ubiquitous genes lead to the degeneration of specific nerves is unknown. We are exploring the biochemical and cell biological basis of these disorders using mice and human cell lines engineered to model patient mutations; this work will also test both pharmacological and gene therapy treatment strategies.,Biotechnology; Charcot-Marie-Tooth Disease; Genetics; Neurodegenerative; Neurosciences; Peripheral Neuropathy; Rare Diseases,N,2024-06-01T00:00:00,2025-05-31T00:00:00,93.853,Non-SBIR/STTR,443236.0,341292.0
11074721,,2024,3R01AR083742-01S1,AR083742,"{'org_name': 'JACKSON LABORATORY', 'city': None, 'country': None, 'org_city': 'BAR HARBOR', 'org_country': 'UNITED STATES', 'org_state': 'ME', 'org_state_name': None, 'dept_type': None, 'fips_country_code': None, 'org_duns': ['042140483'], 'org_ueis': ['XR6LMXNKDJJ1'], 'primary_duns': '042140483', 'primary_uei': 'XR6LMXNKDJJ1', 'org_fips': 'US', 'org_ipf_code': '7096501', 'org_zipcode': '046091523', 'external_org_id': 7096501}",3,R01,13106.0,"{'appl_type_code': '3', 'activity_code': 'R01', 'ic_code': 'AR', 'serial_num': '083742', 'support_year': '01', 'full_support_year': '01S1', 'suffix_code': 'S1'}","[{'profile_id': 10697291, 'first_name': 'Julia', 'middle_name': '', 'last_name': 'Oh', 'is_contact_pi': True, 'full_name': 'Julia  Oh', 'title': ''}]","[{'first_name': 'ANITA', 'middle_name': 'H', 'last_name': 'UNDALE', 'full_name': 'ANITA H UNDALE'}]","{'code': 'AR', 'abbreviation': 'NIAMS', 'name': 'National Institute of Arthritis and Musculoskeletal and Skin Diseases'}","[{'fy': 2024, 'code': 'AR', 'name': 'National Institute of Arthritis and Musculoskeletal and Skin Diseases', 'abbreviation': 'NIAMS', 'total_cost': 13106.0, 'direct_cost_ic': 7123.0, 'indirect_cost_ic': 5983.0}]",ME-02,2024-06-01T00:00:00,2024-10-14T00:00:00,"{'name': 'Research Institutes', 'code': '20', 'is_other': False}",PA-23-189,"{'srg_code': None, 'srg_flex': None, 'sra_designator_code': None, 'sra_flex_code': None, 'group_code': '02', 'name': None}",2024-08-10T00:00:00,R01AR083742,3-Dimensional;Affect;Atopic Dermatitis;CRISPR interference;Cell Separation;Collection;Congenital ichthyosis;Data;Disease;Eczema;Fibroblasts;Genetic Transcription;Genus staphylococcus;Goals;Health;Homeostasis;Human;Immune system;Immunity;Inflammatory;Mediating;Modeling;Molecular;Mucous Membrane;Patients;Proteomics;Role;Signal Pathway;Skin;Staphylococcus aureus;Staphylococcus epidermidis;Staphylococcus haemolyticus;Staphylococcus hominis;Surveys;cell type;commensal microbes;congenital immunodeficiency;experimental study;immunoregulation;inflammatory milieu;intercellular communication;interest;member;metabolomics;microbial;microbiome;pathobiont;response;single-cell RNA sequencing;skin barrier;skin disorder;skin microbiome;transcriptome sequencing;transcriptomics,Molecular mechanisms of staphylococcal modulation of skin homeostasis,"PROJECT NARRATIVE
Staphylococcus sp. are essential members of the human skin microbiome. We seek to understand the
mechanisms by which genetically diverse staphylococci isolated from human skin contribute to skin health and
homeostasis.",Eczema / Atopic Dermatitis; Genetics; Human Genome; Infectious Diseases; Microbiome,N,2024-08-10T00:00:00,2024-10-14T00:00:00,93.846,Non-SBIR/STTR,7123.0,5983.0
